<!ELEMENT enseignants (enseignant+)>
<!ELEMENT enseignant (nom, prenom+, age*) >
<!ELEMENT nom (#PCDATA) >
<!ELEMENT prenom (#PCDATA) >
<!ELEMENT age (#PCDATA) >
<!ATTLIST enseignant
dep CDATA #REQUIRED
>
<!ATTLIST enseignants annÃ©e CDATA #IMPLIED>
<!ENTITY dep "ISIS" >